{
  "schema_version": 1,
  "protocol": {
    "id": "blend",
    "name": "Blend",
    "website": "https://www.blend.capital"
  },
  "contract": {
    "id": "pool-factory",
    "name": "Blend v2 pool factory",
    "version": "v2"
  },
  "source": {
    "repo": "https://github.com/blend-capital/blend-contracts-v2",
    "path": "pool-factory/src/errors.rs",
    "commit": "c19abee5b9be4f49e0cda9057e87d343e5dcc095",
    "enum": "PoolFactoryError"
  },
  "deployments": [
    {
      "network": "mainnet",
      "wasm_hash": "31328050548831f63d2b72e37bcfd0bb7371b7907135755dbe09ed434d755ca9",
      "label": "Blend v2 pool factory code",
      "verified_by": "https://github.com/blend-capital/blend-utils/blob/b05242df30b6b6caf9d317646f754541824a5a8b/wasm_v2/pool_factory.wasm"
    },
    {
      "network": "mainnet",
      "contract_id": "CDSYOAVXFY7SM5S64IZPPPYB4GVGGLMQVFREPSQQEZVIWXX5R23G4QSU",
      "label": "Pool factory (v2)",
      "verified_by": "https://github.com/blend-capital/blend-utils/blob/b05242df30b6b6caf9d317646f754541824a5a8b/mainnet.contracts.json"
    }
  ],
  "errors": [
    {
      "code": 1,
      "name": "InternalError",
      "summary": "Declared for SAC parity; not raised by the v2 pool factory code.",
      "category": "internal",
      "raised_in_source": false,
      "fixes": [
        "Check which contract emitted the error."
      ],
      "status": "draft"
    },
    {
      "code": 3,
      "name": "AlreadyInitializedError",
      "summary": "Declared for SAC parity; not raised by the v2 pool factory code.",
      "category": "internal",
      "raised_in_source": false,
      "mirrors": "stellar/sac#3",
      "fixes": [
        "Check which contract emitted the error."
      ],
      "status": "draft"
    },
    {
      "code": 1300,
      "name": "InvalidPoolInitArgs",
      "summary": "The factory rejected the new pool's settings.",
      "explanation": "deploy() checks that the backstop take rate is below 100% (7 decimals), max_positions is between 2 and 60, and min_collateral is not negative.",
      "category": "admin-config",
      "fixes": [
        "Fix the out-of-range argument and redeploy."
      ],
      "status": "draft"
    }
  ]
}
